{
  "schemaVersion": "1.0.0",
  "contractType": "SEM003C_BLIND_ACCEPTANCE_ENVELOPE",
  "envelopeId": "SEM3-AE-BLIND-PROSTHETIC-VALVE-INFECTION-CONTEXT",
  "version": "1.0.0",
  "caseId": "SEM3-BLIND-PROSTHETIC-VALVE-INFECTION-CONTEXT",
  "reviewStatus": "SIMULATED_REFERENCE_STABLE_FOR_BLIND_CONSTRUCTION",
  "required": [
    {
      "obligationId": "req-1-suspected-infection",
      "semanticKey": "sem3-blind-prosthetic-valve-infection-context.suspected-infection",
      "kind": "EXPLICIT_CONCEPT",
      "description": "Conserver le contexte de suspicion d'infection sur prothèse valvulaire.",
      "rationale": "Cette obligation préserve un contenu, une relation, un statut, une temporalité ou une inconnue qui affecte le sens scientifique.",
      "sourceLocator": "source.conversationTurns[0]",
      "criticality": "CRITICAL",
      "propertyIds": [
        "PROPERTY_EXPLICIT_CONTENT_PRESERVED"
      ],
      "sourceClassification": "INHERENTLY_REQUIRED"
    },
    {
      "obligationId": "req-2-fdg-signal",
      "semanticKey": "sem3-blind-prosthetic-valve-infection-context.fdg-signal",
      "kind": "RELATION",
      "description": "Relier la TEP-TDM au FDG à la description du signal autour de la prothèse.",
      "rationale": "Cette obligation préserve un contenu, une relation, un statut, une temporalité ou une inconnue qui affecte le sens scientifique.",
      "sourceLocator": "source.conversationTurns[1]",
      "criticality": "CRITICAL",
      "propertyIds": [
        "PROPERTY_EXPLICIT_CONTENT_PRESERVED",
        "PROPERTY_EXPLICIT_RELATIONS_PRESERVED"
      ],
      "sourceClassification": "INHERENTLY_REQUIRED"
    },
    {
      "obligationId": "req-3-negative-cultures-possible",
      "semanticKey": "sem3-blind-prosthetic-valve-infection-context.negative-cultures-possible",
      "kind": "POLARITY",
      "description": "Conserver la possibilité d'hémocultures négatives sans en déduire l'absence d'infection.",
      "rationale": "Cette obligation préserve un contenu, une relation, un statut, une temporalité ou une inconnue qui affecte le sens scientifique.",
      "sourceLocator": "source.conversationTurns[2]",
      "criticality": "CRITICAL",
      "propertyIds": [
        "PROPERTY_POLARITY_AND_CONDITIONALITY_PRESERVED",
        "PROPERTY_AMBIGUITY_AND_UNKNOWN_PRESERVED"
      ],
      "sourceClassification": "INHERENTLY_REQUIRED"
    },
    {
      "obligationId": "req-4-coexistence-not-proof",
      "semanticKey": "sem3-blind-prosthetic-valve-infection-context.coexistence-not-proof",
      "kind": "POLARITY",
      "description": "Préserver l'étude d'une association contextuelle sans faire du signal une preuve autonome ni une causalité.",
      "rationale": "Cette obligation préserve un contenu, une relation, un statut, une temporalité ou une inconnue qui affecte le sens scientifique.",
      "sourceLocator": "source.conversationTurns[3]",
      "criticality": "CRITICAL",
      "propertyIds": [
        "PROPERTY_POLARITY_AND_CONDITIONALITY_PRESERVED",
        "PROPERTY_NO_UNSUPPORTED_CAUSAL_PROMOTION"
      ],
      "sourceClassification": "INHERENTLY_REQUIRED"
    },
    {
      "obligationId": "req-5-embolic-events-separate",
      "semanticKey": "sem3-blind-prosthetic-valve-infection-context.embolic-events-separate",
      "kind": "RELATION",
      "description": "Conserver les événements emboliques comme dimension séparée.",
      "rationale": "Cette obligation préserve un contenu, une relation, un statut, une temporalité ou une inconnue qui affecte le sens scientifique.",
      "sourceLocator": "source.conversationTurns[4]",
      "criticality": "CRITICAL",
      "propertyIds": [
        "PROPERTY_EXPLICIT_RELATIONS_PRESERVED",
        "PROPERTY_CONCEPTUAL_PLAN_SEPARATION"
      ],
      "sourceClassification": "INHERENTLY_REQUIRED"
    },
    {
      "obligationId": "req-6-antibiotic-pet-delay-unknown",
      "semanticKey": "sem3-blind-prosthetic-valve-infection-context.antibiotic-pet-delay-unknown",
      "kind": "UNKNOWN",
      "description": "Maintenir ouvert le délai entre antibiothérapie et TEP-TDM.",
      "rationale": "Cette obligation préserve un contenu, une relation, un statut, une temporalité ou une inconnue qui affecte le sens scientifique.",
      "sourceLocator": "source.conversationTurns[5]",
      "criticality": "CRITICAL",
      "propertyIds": [
        "PROPERTY_COMPARISON_AND_TIMING_PRESERVED",
        "PROPERTY_AMBIGUITY_AND_UNKNOWN_PRESERVED",
        "PROPERTY_MISSING_CRITICAL_INFORMATION_DETECTED"
      ],
      "sourceClassification": "INHERENTLY_REQUIRED"
    }
  ],
  "prohibited": [
    {
      "prohibitionId": "pro-1-pet-proves-infection",
      "semanticKey": "sem3-blind-prosthetic-valve-infection-context.forbidden-pet-proves-infection",
      "description": "Présenter le signal TEP ou un support spécialisé comme preuve suffisante et vérité du projet.",
      "rationale": "Cette erreur changerait le sens, le statut épistémique, la provenance ou l'ownership de la demande.",
      "criticality": "CRITICAL",
      "propertyIds": [
        "PROPERTY_NO_UNSUPPORTED_CAUSAL_PROMOTION",
        "PROPERTY_KNOWLEDGE_SUPPORT_NOT_PROJECT_TRUTH",
        "PROPERTY_NO_UNSUPPORTED_INVENTION"
      ],
      "failureClass": "EPISTEMIC_PROMOTION_FAILURE"
    },
    {
      "prohibitionId": "pro-2-pet-causes-embolism",
      "semanticKey": "sem3-blind-prosthetic-valve-infection-context.forbidden-pet-causes-embolism",
      "description": "Créer une relation causale entre signal métabolique et événements emboliques.",
      "rationale": "Cette erreur changerait le sens, le statut épistémique, la provenance ou l'ownership de la demande.",
      "criticality": "CRITICAL",
      "propertyIds": [
        "PROPERTY_NO_UNSUPPORTED_CAUSAL_PROMOTION"
      ],
      "failureClass": "POLARITY_OR_CAUSALITY_FAILURE"
    },
    {
      "prohibitionId": "pro-3-negative-culture-excludes",
      "semanticKey": "sem3-blind-prosthetic-valve-infection-context.forbidden-negative-culture-excludes",
      "description": "Transformer des hémocultures négatives en exclusion de l'infection.",
      "rationale": "Cette erreur changerait le sens, le statut épistémique, la provenance ou l'ownership de la demande.",
      "criticality": "CRITICAL",
      "propertyIds": [
        "PROPERTY_POLARITY_AND_CONDITIONALITY_PRESERVED"
      ],
      "failureClass": "POLARITY_OR_CAUSALITY_FAILURE"
    }
  ],
  "acceptableSemanticVariants": [
    {
      "variantId": "variant-distributed-obligation-graph",
      "label": "Composition distribuée",
      "structureSynopsis": "Plusieurs objets et relations peuvent porter le vecteur d'obligations si leurs statuts, polarités, temporalités, provenance et ownership restent reconstructibles.",
      "preservedObligationIds": [
        "req-1-suspected-infection",
        "req-2-fdg-signal",
        "req-3-negative-cultures-possible",
        "req-4-coexistence-not-proof",
        "req-5-embolic-events-separate",
        "req-6-antibiotic-pet-delay-unknown"
      ],
      "caveats": [
        "Aucune équivalence n'est accordée par simple proximité lexicale.",
        "Le Level 1 critique reste obligatoire."
      ]
    },
    {
      "variantId": "variant-compact-relation-preserving",
      "label": "Composition compacte",
      "structureSynopsis": "Une représentation plus compacte peut être recevable si elle conserve toutes les obligations et n'ajoute aucune promotion ou décision.",
      "preservedObligationIds": [
        "req-1-suspected-infection",
        "req-2-fdg-signal",
        "req-3-negative-cultures-possible",
        "req-4-coexistence-not-proof",
        "req-5-embolic-events-separate",
        "req-6-antibiotic-pet-delay-unknown"
      ],
      "caveats": [
        "La compacité ne permet ni omission critique ni fusion de plans conceptuels.",
        "La topologie n'est pas le critère principal."
      ]
    }
  ],
  "optionalRelevant": [
    {
      "candidateId": "opt-1-pattern-candidate",
      "semanticKey": "sem3-blind-prosthetic-valve-infection-context.optional-pattern-candidate",
      "description": "Un profil de distribution du signal péri-prothétique peut rester un candidat contextuel à qualifier.",
      "epistemicStatus": "CONTEXTUAL_CANDIDATE",
      "rationale": "Le contexte d'imagerie peut motiver ce candidat sans en faire une déclaration utilisateur ni une preuve autonome.",
      "absenceIsBlocking": false,
      "envelopeIsNonExhaustive": true
    }
  ],
  "admissibleAmbiguities": [],
  "expectedClarification": {
    "status": "REQUIRED",
    "decisionImpact": "Le délai après antibiothérapie affecte l'interprétation temporelle du signal.",
    "acceptableQuestionClasses": [
      "Délai entre début des antibiotiques et TEP-TDM"
    ],
    "exactWordingRequired": false
  },
  "ownershipBoundaries": [
    {
      "boundaryId": "own-sem-project",
      "sourceOwner": "SEM",
      "targetOwner": "Research Project / human decision",
      "description": "SEM peut préserver l'intention, les inconnues, ambiguïtés et candidats; il n'adopte pas une décision de projet.",
      "forbiddenPromotion": "Inference, option or contextual candidate to adopted Project decision",
      "adoptionRequiresHumanDecision": true
    },
    {
      "boundaryId": "own-knowledge-specialists",
      "sourceOwner": "Knowledge / OBS / Imaging / Scientific Thinking",
      "targetOwner": "SEM benchmark reference",
      "description": "Les owners spécialisés qualifient preuves, mesures, acquisitions et hypothèses sans devenir la voix de l'utilisateur.",
      "forbiddenPromotion": "Specialist support to explicit user fact, automatic endpoint or Project truth",
      "adoptionRequiresHumanDecision": true
    }
  ],
  "properties": [
    {
      "propertyId": "PROPERTY_AMBIGUITY_AND_UNKNOWN_PRESERVED",
      "family": "SAFETY_FIDELITY_INVARIANT",
      "criticality": "CRITICAL",
      "evaluationMode": "RUN_LEVEL",
      "absolute": true,
      "compensable": false
    },